<?xml version="1.0" encoding="UTF-8"?>
<TableContents xmlns="http://www.faktorzehn.org" numOfColumns="3" tableStructure="tables.TestTable" xmlns:xsi="http://www.w3.org/2001/XMLSchema-instance" xsi:schemaLocation="http://www.faktorzehn.org https://doc.faktorzehn.org/schema/faktor-ips/23.6/TableContents.xsd" xml:space="preserve">
    <Description locale="en">TestDescription</Description>
    <Description locale="fr"/>
    <Description locale="de">TestBeschreibung</Description>
    <ColumnTableReference name="company"/>
    <ColumnTableReference name="Gender"/>
    <ColumnTableReference name="rate"/>
    <Rows>
        <Row>
            <Value isNull="true"></Value>
            <Value>0</Value>
            <Value>0.1</Value>
        </Row>
        <Row>
            <Value>KQV</Value>
            <Value>1</Value>
            <Value>0.15</Value>
        </Row>
        <Row>
            <Value isNull="false">NV</Value>
            <Value isNull="false">0</Value>
            <Value isNull="false">0.2</Value>
        </Row>
        <Row>
            <Value isNull="false">NV</Value>
            <Value isNull="false">1</Value>
            <Value isNull="false">0.25</Value>
        </Row>
        <Row>
            <Value isNull="false">BBV</Value>
            <Value isNull="false">0</Value>
            <Value isNull="false">0.3</Value>
        </Row>
        <Row>
            <Value isNull="false">BBV</Value>
            <Value isNull="false">1</Value>
            <Value isNull="false">0.35</Value>
        </Row>
    </Rows>
</TableContents>

